{"$schema":"https://json-schema.org/draft/2020-12/schema","$id":"https://kdtp.local/schemas/release/v3/m2-external-evidence-intake.schema.json","title":"M2 External Evidence Intake v1","type":"object","additionalProperties":false,"required":["schemaVersion","releaseId","version","contractBaseSha","releaseSourceSha","immutableImageDigest","deploymentManifestDigest","inputs"],"properties":{"schemaVersion":{"const":"m2-external-evidence-intake/v1"},"releaseId":{"const":"M2-RC1"},"version":{"const":"0.12.0"},"contractBaseSha":{"type":"string","pattern":"^[a-f0-9]{40}$"},"releaseSourceSha":{"type":"string","pattern":"^[a-f0-9]{40}$"},"immutableImageDigest":{"type":"string","pattern":"^sha256:[a-f0-9]{64}$"},"deploymentManifestDigest":{"type":"string","pattern":"^sha256:[a-f0-9]{64}$"},"inputs":{"type":"object","additionalProperties":false,"required":["productionSecrets","targetClusterValidation","changeApproval","releaseOwnerApproval"],"properties":{"productionSecrets":{"$ref":"#/$defs/productionSecretsEntry"},"targetClusterValidation":{"$ref":"#/$defs/targetClusterValidationEntry"},"changeApproval":{"$ref":"#/$defs/changeApprovalEntry"},"releaseOwnerApproval":{"$ref":"#/$defs/releaseOwnerApprovalEntry"}}}},"$defs":{"productionSecretPayload":{"type":"object","additionalProperties":false,"required":["releaseId","version","sourceSha","imageDigest","provider","references","configuredAt","verificationRecordId"],"properties":{"releaseId":{"const":"M2-RC1"},"version":{"const":"0.12.0"},"sourceSha":{"type":"string","pattern":"^[a-f0-9]{40}$"},"imageDigest":{"type":"string","pattern":"^sha256:[a-f0-9]{64}$"},"verificationRecordId":{"type":"string","minLength":4,"maxLength":512},"provider":{"enum":["aws-secrets-manager","azure-key-vault","gcp-secret-manager","hashicorp-vault","kubernetes-external-secrets"]},"references":{"type":"array","minItems":1,"uniqueItems":true,"items":{"type":"object","additionalProperties":false,"required":["logicalName","versionedReference","externalResourceId"],"properties":{"logicalName":{"type":"string","minLength":4,"maxLength":128},"versionedReference":{"type":"string","minLength":8,"maxLength":1024},"externalResourceId":{"type":"string","minLength":4,"maxLength":512}}}},"configuredAt":{"type":"string","format":"date-time"}}},"targetClusterValidationPayload":{"type":"object","additionalProperties":false,"required":["releaseId","version","sourceSha","imageDigest","verificationRecordId","deploymentManifestDigest","clusterRef","kubernetesServerVersion","namespaceRef","validationWorkflowRunId","apiDiscoveryDigest","serverSideDryRunDigest","admissionCompatibilityDigest","dependencyReadDigest","permissionEvaluationDigest","nodeArchitectureDigest","validatedAt"],"properties":{"releaseId":{"const":"M2-RC1"},"version":{"const":"0.12.0"},"sourceSha":{"type":"string","pattern":"^[a-f0-9]{40}$"},"imageDigest":{"type":"string","pattern":"^sha256:[a-f0-9]{64}$"},"verificationRecordId":{"type":"string","minLength":4,"maxLength":512},"deploymentManifestDigest":{"type":"string","pattern":"^sha256:[a-f0-9]{64}$"},"clusterRef":{"type":"string","minLength":4,"maxLength":512},"kubernetesServerVersion":{"type":"string","pattern":"^v?\\d+\\.\\d+\\.\\d+(?:[-+][A-Za-z0-9.-]+)?$"},"namespaceRef":{"type":"string","minLength":4,"maxLength":512},"validationWorkflowRunId":{"type":"integer","minimum":1},"apiDiscoveryDigest":{"type":"string","pattern":"^sha256:[a-f0-9]{64}$"},"serverSideDryRunDigest":{"type":"string","pattern":"^sha256:[a-f0-9]{64}$"},"admissionCompatibilityDigest":{"type":"string","pattern":"^sha256:[a-f0-9]{64}$"},"dependencyReadDigest":{"type":"string","pattern":"^sha256:[a-f0-9]{64}$"},"permissionEvaluationDigest":{"type":"string","pattern":"^sha256:[a-f0-9]{64}$"},"nodeArchitectureDigest":{"type":"string","pattern":"^sha256:[a-f0-9]{64}$"},"validatedAt":{"type":"string","format":"date-time"}}},"changeApprovalPayload":{"type":"object","additionalProperties":false,"required":["releaseId","version","sourceSha","imageDigest","verificationRecordId","system","approvalId","scope","status","approvedAt"],"properties":{"releaseId":{"const":"M2-RC1"},"version":{"const":"0.12.0"},"sourceSha":{"type":"string","pattern":"^[a-f0-9]{40}$"},"imageDigest":{"type":"string","pattern":"^sha256:[a-f0-9]{64}$"},"verificationRecordId":{"type":"string","minLength":4,"maxLength":512},"system":{"type":"string","minLength":4,"maxLength":512},"approvalId":{"type":"string","minLength":4,"maxLength":512},"scope":{"type":"string","minLength":4,"maxLength":1024},"status":{"const":"APPROVED"},"approvedAt":{"type":"string","format":"date-time"}}},"releaseOwnerApprovalPayload":{"type":"object","additionalProperties":false,"required":["releaseId","version","sourceSha","imageDigest","verificationRecordId","system","ownerRef","approvalId","status","approvedAt"],"properties":{"releaseId":{"const":"M2-RC1"},"version":{"const":"0.12.0"},"sourceSha":{"type":"string","pattern":"^[a-f0-9]{40}$"},"imageDigest":{"type":"string","pattern":"^sha256:[a-f0-9]{64}$"},"verificationRecordId":{"type":"string","minLength":4,"maxLength":512},"system":{"type":"string","minLength":4,"maxLength":512},"ownerRef":{"type":"string","minLength":4,"maxLength":512},"approvalId":{"type":"string","minLength":4,"maxLength":512},"status":{"const":"APPROVED"},"approvedAt":{"type":"string","format":"date-time"}}},"productionSecretsEntry":{"type":"object","additionalProperties":false,"required":["schemaVersion","status","providedAt","submissionDigest","payload","verification"],"properties":{"schemaVersion":{"const":"m2-production-secret-references-input/v1"},"status":{"enum":["NOT_PROVIDED","PROVIDED_UNVERIFIED","VERIFIED","REJECTED"]},"providedAt":{"anyOf":[{"type":"string","format":"date-time"},{"type":"null"}]},"submissionDigest":{"anyOf":[{"type":"string","pattern":"^sha256:[a-f0-9]{64}$"},{"type":"null"}]},"payload":{"anyOf":[{"$ref":"#/$defs/productionSecretPayload"},{"type":"null"}]},"verification":{"type":"object","additionalProperties":false,"required":["result","method","sourceSystem","externalRecordId","verifiedAt","reasonCode"],"properties":{"result":{"enum":["NOT_RUN","PASSED","FAILED"]},"method":{"type":["string","null"],"minLength":4},"sourceSystem":{"type":["string","null"],"minLength":4},"externalRecordId":{"type":["string","null"],"minLength":4},"verifiedAt":{"anyOf":[{"type":"string","format":"date-time"},{"type":"null"}]},"reasonCode":{"type":["string","null"],"enum":["NOT_PROVIDED","AWAITING_EXTERNAL_VERIFICATION","PLACEHOLDER_DETECTED","FORMAT_INVALID","SENSITIVE_MATERIAL","EXTERNAL_ID_MISMATCH","TIMESTAMP_INVALID","BINDING_MISMATCH","VERIFICATION_FAILED",null]}}}}},"targetClusterValidationEntry":{"type":"object","additionalProperties":false,"required":["schemaVersion","status","providedAt","submissionDigest","payload","verification"],"properties":{"schemaVersion":{"const":"m2-target-cluster-validation-input/v1"},"status":{"enum":["NOT_PROVIDED","PROVIDED_UNVERIFIED","VERIFIED","REJECTED"]},"providedAt":{"anyOf":[{"type":"string","format":"date-time"},{"type":"null"}]},"submissionDigest":{"anyOf":[{"type":"string","pattern":"^sha256:[a-f0-9]{64}$"},{"type":"null"}]},"payload":{"anyOf":[{"$ref":"#/$defs/targetClusterValidationPayload"},{"type":"null"}]},"verification":{"type":"object","additionalProperties":false,"required":["result","method","sourceSystem","externalRecordId","verifiedAt","reasonCode"],"properties":{"result":{"enum":["NOT_RUN","PASSED","FAILED"]},"method":{"type":["string","null"],"minLength":4},"sourceSystem":{"type":["string","null"],"minLength":4},"externalRecordId":{"type":["string","null"],"minLength":4},"verifiedAt":{"anyOf":[{"type":"string","format":"date-time"},{"type":"null"}]},"reasonCode":{"type":["string","null"],"enum":["NOT_PROVIDED","AWAITING_EXTERNAL_VERIFICATION","PLACEHOLDER_DETECTED","FORMAT_INVALID","SENSITIVE_MATERIAL","EXTERNAL_ID_MISMATCH","TIMESTAMP_INVALID","BINDING_MISMATCH","VERIFICATION_FAILED",null]}}}}},"changeApprovalEntry":{"type":"object","additionalProperties":false,"required":["schemaVersion","status","providedAt","submissionDigest","payload","verification"],"properties":{"schemaVersion":{"const":"m2-change-approval-input/v1"},"status":{"enum":["NOT_PROVIDED","PROVIDED_UNVERIFIED","VERIFIED","REJECTED"]},"providedAt":{"anyOf":[{"type":"string","format":"date-time"},{"type":"null"}]},"submissionDigest":{"anyOf":[{"type":"string","pattern":"^sha256:[a-f0-9]{64}$"},{"type":"null"}]},"payload":{"anyOf":[{"$ref":"#/$defs/changeApprovalPayload"},{"type":"null"}]},"verification":{"type":"object","additionalProperties":false,"required":["result","method","sourceSystem","externalRecordId","verifiedAt","reasonCode"],"properties":{"result":{"enum":["NOT_RUN","PASSED","FAILED"]},"method":{"type":["string","null"],"minLength":4},"sourceSystem":{"type":["string","null"],"minLength":4},"externalRecordId":{"type":["string","null"],"minLength":4},"verifiedAt":{"anyOf":[{"type":"string","format":"date-time"},{"type":"null"}]},"reasonCode":{"type":["string","null"],"enum":["NOT_PROVIDED","AWAITING_EXTERNAL_VERIFICATION","PLACEHOLDER_DETECTED","FORMAT_INVALID","SENSITIVE_MATERIAL","EXTERNAL_ID_MISMATCH","TIMESTAMP_INVALID","BINDING_MISMATCH","VERIFICATION_FAILED",null]}}}}},"releaseOwnerApprovalEntry":{"type":"object","additionalProperties":false,"required":["schemaVersion","status","providedAt","submissionDigest","payload","verification"],"properties":{"schemaVersion":{"const":"m2-release-owner-approval-input/v1"},"status":{"enum":["NOT_PROVIDED","PROVIDED_UNVERIFIED","VERIFIED","REJECTED"]},"providedAt":{"anyOf":[{"type":"string","format":"date-time"},{"type":"null"}]},"submissionDigest":{"anyOf":[{"type":"string","pattern":"^sha256:[a-f0-9]{64}$"},{"type":"null"}]},"payload":{"anyOf":[{"$ref":"#/$defs/releaseOwnerApprovalPayload"},{"type":"null"}]},"verification":{"type":"object","additionalProperties":false,"required":["result","method","sourceSystem","externalRecordId","verifiedAt","reasonCode"],"properties":{"result":{"enum":["NOT_RUN","PASSED","FAILED"]},"method":{"type":["string","null"],"minLength":4},"sourceSystem":{"type":["string","null"],"minLength":4},"externalRecordId":{"type":["string","null"],"minLength":4},"verifiedAt":{"anyOf":[{"type":"string","format":"date-time"},{"type":"null"}]},"reasonCode":{"type":["string","null"],"enum":["NOT_PROVIDED","AWAITING_EXTERNAL_VERIFICATION","PLACEHOLDER_DETECTED","FORMAT_INVALID","SENSITIVE_MATERIAL","EXTERNAL_ID_MISMATCH","TIMESTAMP_INVALID","BINDING_MISMATCH","VERIFICATION_FAILED",null]}}}}}}}
