{
  "schemaVersion": "m2-external-evidence-intake/v1",
  "releaseId": "M2-RC1",
  "version": "0.12.0",
  "contractBaseSha": "ebfa1a16f95146b48f11934aecc3d41bcd605f57",
  "releaseSourceSha": "6bef789da58bbb7f2edd2a2024ba9a0bbf8e22a7",
  "immutableImageDigest": "sha256:9ea3d4ac1ece9aa3d47c658a0781e15ce9eafdfc56a20eb041251298b465ab13",
  "deploymentManifestDigest": "sha256:fb2cb10f42f8d3473c1997c514ec11eb66bfb06f7542c3404c328c39f8763a45",
  "inputs": {
    "productionSecrets": {
      "schemaVersion": "m2-production-secret-references-input/v1",
      "status": "NOT_PROVIDED",
      "providedAt": null,
      "submissionDigest": null,
      "payload": null,
      "verification": {
        "result": "NOT_RUN",
        "method": null,
        "sourceSystem": null,
        "externalRecordId": null,
        "verifiedAt": null,
        "reasonCode": "NOT_PROVIDED"
      }
    },
    "targetClusterValidation": {
      "schemaVersion": "m2-target-cluster-validation-input/v1",
      "status": "NOT_PROVIDED",
      "providedAt": null,
      "submissionDigest": null,
      "payload": null,
      "verification": {
        "result": "NOT_RUN",
        "method": null,
        "sourceSystem": null,
        "externalRecordId": null,
        "verifiedAt": null,
        "reasonCode": "NOT_PROVIDED"
      }
    },
    "changeApproval": {
      "schemaVersion": "m2-change-approval-input/v1",
      "status": "NOT_PROVIDED",
      "providedAt": null,
      "submissionDigest": null,
      "payload": null,
      "verification": {
        "result": "NOT_RUN",
        "method": null,
        "sourceSystem": null,
        "externalRecordId": null,
        "verifiedAt": null,
        "reasonCode": "NOT_PROVIDED"
      }
    },
    "releaseOwnerApproval": {
      "schemaVersion": "m2-release-owner-approval-input/v1",
      "status": "NOT_PROVIDED",
      "providedAt": null,
      "submissionDigest": null,
      "payload": null,
      "verification": {
        "result": "NOT_RUN",
        "method": null,
        "sourceSystem": null,
        "externalRecordId": null,
        "verifiedAt": null,
        "reasonCode": "NOT_PROVIDED"
      }
    }
  }
}
